{"suggestion_set_id":"suggestion_golden","model_run_id":"run_golden","prediction_id":"prediction_golden","context":{"project_id":"project_golden","asset_revision_id":"asset_revision_golden","annotation_revision_id":"revision_golden","ontology_version_id":"ontology_v1","draft_generation":0,"canonical_sha256":"bbbbbbbbbbbbbbbbbbbbbbbbbbbbbbbbbbbbbbbbbbbbbbbbbbbbbbbbbbbbbbbb","selected_object_ids":["object_person_001"],"object_hashes":{},"input_fingerprint":"fingerprint_golden"},"changes":[{"kind":"set_attributes","change_id":"change_golden","object_id":"object_person_001","values":{"helmet_state":"wearing"},"before_hash":"aaaaaaaaaaaaaaaaaaaaaaaaaaaaaaaaaaaaaaaaaaaaaaaaaaaaaaaaaaaaaaaa","reason":"fixture"}],"issues":[],"score":null,"state":"pending"}